outcode,district_code,region,county_name,local_authority,District_name,ward_name,most_current_pop_year,population,pop_dens_sq_km
M29,"E08000010, E08000006",North West,Greater Manchester,,"Wigan, Salford","Tyldesley & Mosley Common, Astley, Leigh South, Boothstown & Ellenbrook, Atherton South & Lilford, Atherton North",2021.0,45726.0,704375.7
M3,"E08000006, E08000003",North West,Greater Manchester,,"Salford, Manchester","Blackfriars & Trinity, Deansgate, Cheetham, Hulme, Ordsall, Broughton",2021.0,16942.0,1033127.6
M30,E08000006,North West,Greater Manchester,,Salford,"Eccles, Weaste & Seedley, Barton & Winton, Higher Irlam & Peel Green, Worsley & Westwood Park",2021.0,59820.0,1213057.6
M31,E08000009,North West,Greater Manchester,,Trafford,"Bucklow-St Martins, Urmston",2021.0,49429.0,782976.7
M32,E08000009,North West,Greater Manchester,,Trafford,"Stretford & Humphrey Park, Gorse Hill & Cornbrook, Longford, Lostock & Barton, Sale Central",2021.0,27588.0,569186.2
M33,"E08000009, E08000003",North West,Greater Manchester,,"Trafford, Manchester","Sale Central, Sale Moor, Brooklands, Timperley North, Manor, Broadheath, Ashton upon Mersey, Bucklow-St Martins",2021.0,60859.0,1114657.1
M34,E08000008,North West,Greater Manchester,,Tameside,"Denton North East, Denton West, Audenshaw, St Peter's, Denton South",2021.0,48816.0,900074.4
M35,E08000004,North West,Greater Manchester,,Oldham,"Failsworth East, Failsworth West",2021.0,44352.0,912294.3
M38,E08000006,North West,Greater Manchester,,Salford,"Little Hulton, Walkden North, Walkden South",,,
M4,E08000003,North West,Greater Manchester,,Manchester,"Piccadilly, Deansgate, Cheetham, Miles Platting & Newton Heath, Ancoats & Beswick",2021.0,14913.0,2026900.0
M40,"E08000003, E08000004",North West,Greater Manchester,,"Manchester, Oldham","Moston, Charlestown, Chadderton South, Miles Platting & Newton Heath, Failsworth West, Clayton & Openshaw, Harpurhey, Ancoats & Beswick",2021.0,1310.0,21106.4
M41,E08000009,North West,Greater Manchester,,Trafford,"Urmston, Lostock & Barton, Flixton, Davyhulme, Bucklow-St Martins, Gorse Hill & Cornbrook, Stretford & Humphrey Park",2021.0,201.0,3743.0
M43,"E08000008, E08000003",North West,Greater Manchester,,"Tameside, Manchester","Droylsden East, Clayton & Openshaw, Droylsden West, Audenshaw, Ashton Waterloo",2021.0,662.0,10299.0
M44,E08000006,North West,Greater Manchester,,Salford,"Cadishead & Lower Irlam, Higher Irlam & Peel Green",2021.0,1140.0,25961.5
M45,E08000002,North West,Greater Manchester,,Bury,"St. Mary's, Pilkington Park, Besses, Holyrood, Unsworth",,,
M46,"E08000010, E08000001",North West,Greater Manchester,,"Wigan, Bolton","Atherton South & Lilford, Atherton North, Hulton",2021.0,1304.0,23972.1
M5,E08000006,North West,Greater Manchester,,Salford,"Pendleton & Charlestown, Ordsall, Quays, Weaste & Seedley",2021.0,27209.0,985477.2
M50,E08000006,North West,Greater Manchester,,Salford,"Weaste & Seedley, Quays, Pendleton & Charlestown",2021.0,3041.0,243061.5
M6,E08000006,North West,Greater Manchester,,Salford,"Pendleton & Charlestown, Weaste & Seedley, Claremont, Eccles",2021.0,31127.0,1016123.1
M60,"E08000003, E08000006",North West,Greater Manchester,,"Manchester, Salford","Piccadilly, Deansgate, Cheetham, Ordsall",,,
M61,E08000003,North West,Greater Manchester,,Manchester,"Piccadilly, Deansgate",,,
M7,"E08000006, E08000003, E08000002",North West,Greater Manchester,,"Salford, Manchester, Bury","Broughton, Cheetham, Kersal & Broughton Park, St. Mary's, Crumpsall",2021.0,35149.0,906871.1
M8,"E08000003, E08000002, E08000006",North West,Greater Manchester,,"Manchester, Bury, Salford","Crumpsall, Cheetham, Harpurhey, Sedgley, Higher Blackley, Broughton",2021.0,32800.0,805403.7
M9,E08000003,North West,Greater Manchester,,Manchester,"Higher Blackley, Harpurhey, Moston, Crumpsall, Charlestown",2021.0,39886.0,786155.1
M90,E08000003,North West,Greater Manchester,,Manchester,"Woodhouse Park, Northenden",,,
M99,E08000003,North West,Greater Manchester,,Manchester,"Piccadilly, Deansgate",,,
ME1,"E06000035, E07000115",South East,Kent,Kent,"Medway, Tonbridge and Malling","Rochester West & Borstal, Rochester East & Warren Wood, Fort Pitt, Fort Horsted, Aylesford North & North Downs",2021.0,36752.0,684878.9
ME10,E07000113,South East,Kent,Kent,Swale,"Chalkwell, Homewood, Borden and Grove Park, Woodstock, Milton Regis, Kemsley, The Meads, Roman, Murston, Teynham and Lynsted, West Downs",2021.0,53581.0,937608.8
ME11,E07000113,South East,Kent,Kent,Swale,"Queenborough and Halfway, Sheerness",2021.0,5094.0,53197.0
ME12,E07000113,South East,Kent,Kent,Swale,"Sheerness, Minster Cliffs, Sheppey Central, Queenborough and Halfway, Sheppey East",2021.0,42255.0,633482.6
ME13,"E07000113, E07000110, E07000105",South East,Kent,Kent,"Swale, Maidstone, Ashford","East Downs, Watling, North Downs, Boughton and Courtenay, Charing, Downs West, Teynham and Lynsted, Abbey, Priory, St Ann's",2021.0,29496.0,358698.2
ME14,E07000110,South East,Kent,Kent,Maidstone,"High Street, East, North, Park Wood, Boxley, Detling and Thurnham, North Downs, Bearsted, Shepway North",2021.0,39154.0,606032.8
ME15,E07000110,South East,Kent,Kent,Maidstone,"Loose, Coxheath and Hunton, South, Marden and Yalding, Park Wood, High Street, Shepway North, Shepway South, Bearsted, Downswood and Otham",2021.0,54757.0,864774.5
ME16,"E07000110, E07000115",South East,Kent,Kent,"Maidstone, Tonbridge and Malling","Allington, Bridge, Heath, Aylesford South & Ditton, Fant, Park Wood, Barming and Teston",2021.0,33207.0,555414.2
ME17,"E07000110, E07000105",South East,Kent,Kent,"Maidstone, Ashford","Harrietsham and Lenham, Leeds, Headcorn, North Downs, Sutton Valence and Langley, Detling and Thurnham, Upper Weald, Park Wood, Boughton Monchelsea and Chart Sutton, Downswood and Otham, Coxheath and Hunton, Loose",2021.0,25485.0,134315.2
ME18,"E07000115, E07000110",South East,Kent,Kent,"Tonbridge and Malling, Maidstone","East and West Peckham, Mereworth & Wateringbury, Marden and Yalding, Barming and Teston, Coxheath and Hunton",2021.0,7691.0,26353.5
ME19,E07000115,South East,Kent,Kent,Tonbridge and Malling,"Kings Hill, Snodland East & Ham Hill, East Malling, West Malling & Offham, Birling, Leybourne & Ryarsh, Pilgrims with Ightham, Aylesford South & Ditton",2021.0,26624.0,266225.4
ME2,"E06000035, E07000115, E07000109",South East,Kent,Kent,"Medway, Tonbridge and Malling, Gravesham","Cuxton, Halling & Riverside, Snodland West & Holborough Lakes, Strood North & Frindsbury, Strood West, Strood Rural, Higham & Shorne, Istead Rise, Cobham & Luddesdown, Rochester West & Borstal",2021.0,42744.0,744991.9
ME20,"E07000115, E07000110",South East,Kent,Kent,"Tonbridge and Malling, Maidstone","Larkfield, Aylesford South & Ditton, East Malling, West Malling & Offham, Snodland East & Ham Hill, Aylesford North & North Downs, Boxley",2021.0,20790.0,241193.3
ME3,"E06000035, E07000109",South East,Kent,Kent,"Medway, Gravesham","All Saints, Higham & Shorne, Strood Rural, Hoo St Werburgh & High Halstow, Rochester West & Borstal",2021.0,29518.0,238340.2
ME4,E06000035,South East,Kent,,Medway,"St Mary's Island, Chatham Central & Brompton, Fort Pitt, Gillingham North, Luton, Fort Horsted",2021.0,34070.0,930789.9
ME5,"E06000035, E07000110, E07000115",South East,Kent,Kent,"Medway, Maidstone, Tonbridge and Malling","Luton, Wayfield & Weeds Wood, Fort Pitt, Fort Horsted, Chatham Central & Brompton, Gillingham South, Watling, Princes Park, Hempstead & Wigmore, Lordswood & Walderslade, Boxley, Aylesford North & North Downs, Walderslade",2021.0,52443.0,901695.3
ME6,E07000115,South East,Kent,Kent,Tonbridge and Malling,"Snodland East & Ham Hill, Snodland West & Holborough Lakes, Birling, Leybourne & Ryarsh, Kings Hill",2021.0,11166.0,191355.6
ME7,"E06000035, E07000110",South East,Kent,Kent,"Medway, Maidstone","Gillingham South, Gillingham North, Chatham Central & Brompton, Watling, Rainham North, Hempstead & Wigmore, Boxley, Lordswood & Walderslade",2021.0,50761.0,1309295.2
ME8,"E06000035, E07000113",South East,Kent,Kent,"Medway, Swale","Rainham South West, Hempstead & Wigmore, Watling, Rainham South East, Twydall, Rainham North, Hartlip, Newington and Upchurch",2021.0,50008.0,867199.5
ME9,"E07000113, E07000110, E06000035",South East,Kent,Kent,"Swale, Maidstone, Medway","West Downs, Teynham and Lynsted, East Downs, North Downs, Bobbing, Iwade and Lower Halstow, Hartlip, Newington and Upchurch, Borden and Grove Park, Rainham South East, Homewood, Kemsley, Murston",2021.0,20876.0,110807.1
MK1,E06000042,South East,Buckinghamshire,,Milton Keynes,"Bletchley East, Bletchley Park",2021.0,11763.0,125475.4
MK10,E06000042,South East,Buckinghamshire,,Milton Keynes,"Monkston, Central Milton Keynes, Broughton",2021.0,24913.0,511952.4
MK11,E06000042,South East,Buckinghamshire,,Milton Keynes,"Stony Stratford, Bradwell",2021.0,11935.0,140130.8
MK12,E06000042,South East,Buckinghamshire,,Milton Keynes,"Wolverton, Bradwell",2021.0,17899.0,268717.5
MK13,E06000042,South East,Buckinghamshire,,Milton Keynes,"Wolverton, Stantonbury, Bradwell, Central Milton Keynes, Loughton & Shenley",2021.0,17024.0,226946.6
MK14,E06000042,South East,Buckinghamshire,,Milton Keynes,"Newport Pagnell North & Hanslope, Newport Pagnell South, Stantonbury, Central Milton Keynes, Campbell Park & Old Woughton",2021.0,19560.0,257551.1
MK15,E06000042,South East,Buckinghamshire,,Milton Keynes,"Campbell Park & Old Woughton, Broughton, Newport Pagnell South, Monkston",2021.0,6817.0,73951.1
MK16,"E06000042, E06000062","South East, East Midlands","Buckinghamshire, Northamptonshire",,"Milton Keynes, West Northamptonshire","Newport Pagnell South, Olney, Broughton, Newport Pagnell North & Hanslope, Hackleton and Grange Park",2021.0,20434.0,216541.7
MK17,"E06000060, E06000042, E06000056","South East, East of England","Buckinghamshire, Bedfordshire",,"Buckinghamshire, Milton Keynes, Central Bedfordshire","Great Brickhill, Winslow, Monkston, Danesborough & Walton, Aspley & Woburn, Cranfield & Marston Moretaine, Broughton, Bletchley East, Westoning, Flitton & Greenfield",2021.0,21856.0,77095.3
MK18,"E06000060, E07000177",South East,"Buckinghamshire, Oxfordshire",Oxfordshire,"Buckinghamshire, Cherwell","Buckingham East, Buckingham West, Winslow, Grendon Underwood, Great Brickhill, Fringford and Heyfords",2021.0,34312.0,251224.3
MK19,"E06000062, E06000060, E06000042","East Midlands, South East","Northamptonshire, Buckinghamshire",,"West Northamptonshire, Buckinghamshire, Milton Keynes","Deanshanger, Buckingham East, Winslow, Stony Stratford, Bradwell, Newport Pagnell North & Hanslope",2021.0,12404.0,73137.3
MK2,"E06000042, E06000060",South East,Buckinghamshire,,"Milton Keynes, Buckinghamshire","Bletchley Park, Bletchley East, Great Brickhill",2021.0,14472.0,241985.1
MK3,"E06000042, E06000060",South East,Buckinghamshire,,"Milton Keynes, Buckinghamshire","Bletchley Park, Bletchley East, Great Brickhill, Bletchley West",2021.0,25431.0,453407.7
MK4,E06000042,South East,Buckinghamshire,,Milton Keynes,"Bletchley West, Shenley Brook End, Bletchley East, Tattenhoe, Loughton & Shenley",2021.0,24926.0,373870.3
MK40,E06000055,East of England,Bedfordshire,,Bedford,"Greyfriars, Castle & Newnham, Harpur, De Parys, Kingsbrook, Biddenham, Great Denham, Queens Park",2021.0,43280.0,1037551.6
MK41,E06000055,East of England,Bedfordshire,,Bedford,"Goldington, Putnoe, Riverfield, Renhold & Ravensden, Greyfriars, Clapham & Oakley, Harpur, Brickhill, De Parys, Castle & Newnham",2021.0,42615.0,644225.1
MK42,"E06000055, E06000056",East of England,Bedfordshire,,"Bedford, Central Bedfordshire","Cauldwell, Shortstown, Kingsbrook, Greyfriars, Wixams & Wilstead, Houghton Conquest & Haynes, Kempston West, Kempston South, Kempston Central & East, Kempston North",2021.0,55540.0,870409.7
MK43,"E06000056, E06000055, E06000042","East of England, South East","Bedfordshire, Buckinghamshire",,"Central Bedfordshire, Bedford, Milton Keynes","Cranfield & Marston Moretaine, Greyfriars, Ampthill, Aspley & Woburn, Harrold, Sharnbrook, Clapham & Oakley, Bromham, Olney, Wootton & Kempston Rural, Kempston West, Wixams & Wilstead, Houghton Conquest & Haynes",2021.0,41921.0,319683.9
MK44,"E06000055, E07000011, E06000056",East of England,"Bedfordshire, Cambridgeshire",Cambridgeshire,"Bedford, Huntingdonshire, Central Bedfordshire","Sharnbrook, Riseley, Harrold, Kimbolton, Wyboston, Great Staughton, Renhold & Ravensden, Great Barford, Clapham & Oakley, Greyfriars, Kingsbrook, Shortstown, Northill, Sandy",2021.0,17006.0,35539.1
MK45,"E06000056, E06000055",East of England,Bedfordshire,,"Central Bedfordshire, Bedford","Flitwick, Westoning, Flitton & Greenfield, Ampthill, Houghton Conquest & Haynes, Cranfield & Marston Moretaine, Greyfriars, Shortstown, Wixams & Wilstead, Northill, Barton-le-Clay & Silsoe, Meppershall & Shillington, Toddington",2021.0,48528.0,430078.2
MK46,E06000042,South East,Buckinghamshire,,Milton Keynes,"Olney, Newport Pagnell South",2021.0,8840.0,79031.1
MK5,E06000042,South East,Buckinghamshire,,Milton Keynes,"Loughton & Shenley, Bletchley East, Shenley Brook End",2021.0,15240.0,178268.9
MK6,E06000042,South East,Buckinghamshire,,Milton Keynes,"Central Milton Keynes, Woughton & Fishermead, Monkston, Campbell Park & Old Woughton, Bletchley West",2021.0,26647.0,388434.3
MK7,E06000042,South East,Buckinghamshire,,Milton Keynes,"Monkston, Danesborough & Walton",2021.0,14213.0,166995.7
MK77,E06000042,South East,Buckinghamshire,,Milton Keynes,"Bradwell, Bletchley East",,,
MK8,E06000042,South East,Buckinghamshire,,Milton Keynes,"Stony Stratford, Bradwell, Loughton & Shenley",2021.0,12200.0,202428.6
MK9,E06000042,South East,Buckinghamshire,,Milton Keynes,"Central Milton Keynes, Monkston, Campbell Park & Old Woughton",2021.0,3767.0,194403.1
N1,"E09000019, E09000007, E09000012",London,Greater London,,"Islington, Camden, Hackney","Caledonian, Barnsbury, St Mary's & St James', King's Cross, St Peter's & Canalside, Laycock, Canonbury, Mildmay, Highbury, De Beauvoir, Haggerston, Hoxton East & Shoreditch, Hoxton West, Clerkenwell",2021.0,91897.0,6293313.4
N10,"E09000003, E09000014",London,Greater London,,"Barnet, Haringey","Friern Barnet, Fortis Green, Muswell Hill, East Finchley, Alexandra Park, Highgate",2021.0,29194.0,849331.9
N11,"E09000010, E09000003, E09000014",London,Greater London,,"Enfield, Barnet, Haringey","New Southgate, Arnos Grove, Brunswick Park, Bowes, Bounds Green, Alexandra Park, Friern Barnet, Woodhouse",2021.0,35418.0,903127.6
N12,E09000003,London,Greater London,,Barnet,"Woodhouse, West Finchley, Friern Barnet, Totteridge & Woodside, Whetstone",2021.0,33170.0,894064.9
N13,"E09000010, E09000014",London,Greater London,,"Enfield, Haringey","Palmers Green, Winchmore Hill, Arnos Grove, Southgate, New Southgate, Bowes, Highfield, White Hart Lane",2021.0,37254.0,931204.6
N14,"E09000010, E09000003",London,Greater London,,"Enfield, Barnet","Cockfosters, Oakwood, Southgate, East Barnet, Brunswick Park, Arnos Grove, Palmers Green",2021.0,28981.0,533463.9
N15,"E09000014, E09000019, E09000012",London,Greater London,,"Haringey, Islington, Hackney","St Ann's, West Green, Harringay, Hermitage & Gardens, Junction, Tottenham Central, South Tottenham, Seven Sisters, Springfield",2021.0,55523.0,2429188.9
N16,"E09000012, E09000019",London,Greater London,,"Hackney, Islington","Stoke Newington, Clissold, Stamford Hill West, Springfield, Woodberry Down, Cazenove, Hackney Downs, Shacklewell, Dalston, Mildmay, Highbury",2021.0,62809.0,3288498.7
N17,"E09000014, E09000010, E09000031",London,Greater London,,"Haringey, Enfield, Waltham Forest","Northumberland Park, Tottenham Central, Upper Edmonton, West Green, Bruce Castle, White Hart Lane, Tottenham Hale, South Tottenham, St James",2021.0,68327.0,3358563.0
N18,"E09000010, E09000014",London,Greater London,,"Enfield, Haringey","Bowes, Upper Edmonton, Haselbury, Highfield, Edmonton Green, Northumberland Park",2021.0,34890.0,1280091.0
N19,"E09000019, E09000007",London,Greater London,,"Islington, Camden","Hillrise, Junction, Tollington, Tufnell Park, Kentish Town North, Highgate",2021.0,40315.0,2296199.8
N1C,E09000007,London,Greater London,,Camden,"King's Cross, St Pancras & Somers Town, Camden Square",2021.0,1526.0,45650.0
N1P,E09000019,London,Greater London,,Islington,St Mary's & St James',,,
N2,"E09000003, E09000014",London,Greater London,,"Barnet, Haringey","Garden Suburb, Highgate, East Finchley, Fortis Green",2021.0,25790.0,687318.7
N20,E09000003,London,Greater London,,Barnet,"Whetstone, Brunswick Park, Friern Barnet, Woodhouse, Totteridge & Woodside, Barnet Vale",2021.0,17053.0,282022.0
N21,E09000010,London,Greater London,,Enfield,"Winchmore Hill, Oakwood, Grange Park, Southgate, Bush Hill Park, Highfield",2021.0,21211.0,360108.5
N22,"E09000014, E09000010",London,Greater London,,"Haringey, Enfield","Woodside, White Hart Lane, West Green, Noel Park, Bounds Green, Alexandra Park, Muswell Hill, New Southgate, Bowes",2021.0,40949.0,1666089.4
N3,E09000003,London,Greater London,,Barnet,"West Finchley, Finchley Church End, Totteridge & Woodside, Mill Hill",2021.0,25818.0,575353.0
N4,"E09000014, E09000012, E09000019",London,Greater London,,"Haringey, Hackney, Islington","Harringay, Hermitage & Gardens, Woodberry Down, Brownswood, Arsenal, Finsbury Park, Stroud Green, Clissold, Tollington, Hillrise, Junction, Crouch End",2021.0,53868.0,3509698.0
N5,"E09000019, E09000012",London,Greater London,,"Islington, Hackney","Highbury, Arsenal, Laycock, Mildmay, Brownswood, Clissold",2021.0,23744.0,1361927.7
N6,"E09000014, E09000019, E09000007, E09000003",London,Greater London,,"Haringey, Islington, Camden, Barnet","Highgate, Tollington, Fortis Green, East Finchley, Crouch End, Hillrise, Junction",2021.0,17451.0,610550.8
N7,"E09000019, E09000007",London,Greater London,,"Islington, Camden","Tufnell Park, Holloway, Kentish Town South, Kentish Town North, Junction, Tollington, Finsbury Park, Arsenal, Laycock, Barnsbury, Highbury, Caledonian, Camden Square",2021.0,48173.0,3185496.6
N8,"E09000014, E09000005, E09000019",London,Greater London,,"Haringey, Brent, Islington","Harringay, Noel Park, Kilburn, Hornsey, Crouch End, Muswell Hill, Hillrise, Stroud Green",2021.0,36318.0,1756763.6
N81,"E09000025, E09000014",London,Greater London,,"Newham, Haringey","Canning Town North, Noel Park",,,
N9,E09000010,London,Greater London,,Enfield,"Lower Edmonton, Edmonton Green, Jubilee, Haselbury, Bush Hill Park, Highfield",2021.0,48778.0,1718846.4
NE1,E08000021,North East,Tyne and Wear,,Newcastle upon Tyne,"Monument, Ouseburn, Arthur's Hill",2021.0,22556.0,538997.0
NE10,"E08000037, E08000023",North East,Tyne and Wear,,"Gateshead, South Tyneside","Felling, Pelaw and Heworth, Bridges, Wardley and Leam Lane, Windy Nook and Whitehills, Fellgate and Hedworth, Deckham",2021.0,37165.0,622060.4
NE11,E08000037,North East,Tyne and Wear,,Gateshead,"Lobley Hill and Bensham, Lamesley, Whickham South and Sunniside, Dunston and Teams, Whickham North, Dunston Hill and Whickham East",2021.0,16543.0,284729.5
NE12,E08000022,North East,Tyne and Wear,,North Tyneside,"Benton, Camperdown, Weetslade, Killingworth, Longbenton, Northumberland",2021.0,38676.0,591159.6
NE13,"E08000022, E06000057, E08000021",North East,"Tyne and Wear, Northumberland",,"North Tyneside, Northumberland, Newcastle upon Tyne","Weetslade, Ponteland East and Stannington, Castle, Parklands, Callerton & Throckley",2021.0,23021.0,237919.5
NE15,"E06000057, E08000021, E08000037",North East,"Northumberland, Tyne and Wear",,"Northumberland, Newcastle upon Tyne, Gateshead","Ponteland West, Bywell, Ponteland South with Heddon, Benwell & Scotswood, Lemington, Callerton & Throckley, Ryton, Crookhill and Stella, Chapel, West Fenham",2021.0,36682.0,508024.6
NE16,"E08000037, E06000047",North East,"Tyne and Wear, County Durham",,"Gateshead, County Durham","Whickham North, Blaydon, Dunston Hill and Whickham East, Whickham South and Sunniside, Lamesley, Tanfield, Burnopfield and Dipton",2021.0,24079.0,337766.2
NE17,"E08000037, E06000057, E06000047",North East,"Tyne and Wear, Northumberland, County Durham",,"Gateshead, Northumberland, County Durham","Chopwell and Rowlands Gill, Winlaton and High Spen, South Tynedale, Leadgate and Medomsley, Prudhoe North",2021.0,4956.0,54388.9
NE18,E06000057,North East,Northumberland,,Northumberland,"Ponteland West, Ponteland South with Heddon, Bywell",2021.0,980.0,5105.900000000001
NE19,E06000057,North East,Northumberland,,Northumberland,"Rothbury, Bellingham, Ponteland North, Ponteland West, Corbridge, Humshaugh",2021.0,4134.0,3914.0
NE2,E08000021,North East,Tyne and Wear,,Newcastle upon Tyne,"Ouseburn, South Jesmond, Monument, North Jesmond, Dene & South Gosforth, Gosforth, Wingrove, Arthur's Hill",2021.0,29676.0,836679.5
NE20,"E06000057, E08000021",North East,"Northumberland, Tyne and Wear",,"Northumberland, Newcastle upon Tyne","Ponteland North, Ponteland East and Stannington, Ponteland West, Callerton & Throckley, Ponteland South with Heddon",2021.0,11324.0,50681.7
NE21,E08000037,North East,Tyne and Wear,,Gateshead,"Blaydon, Ryton, Crookhill and Stella, Winlaton and High Spen, Crawcrook and Greenside",2021.0,18057.0,288181.3
NE22,E06000057,North East,Northumberland,,Northumberland,"Bedlington Central, Bedlington East, Sleekburn, Kitty Brewster, Bedlington West, Stakeford, Choppington",2021.0,20282.0,230433.0
NE23,"E06000057, E08000022",North East,"Northumberland, Tyne and Wear",,"Northumberland, North Tyneside","Cramlington West, Cramlington Eastfield, Cramlington Village, Cramlington North, Cramlington East, Seghill with Seaton Delaval, Cramlington South East, Weetslade, Camperdown, Holywell",2021.0,39817.0,540213.3
NE24,E06000057,North East,Northumberland,,Northumberland,"Wensleydale, Croft, Sleekburn, Cowpen, Isabella, Plessey, South Blyth, Hartley, Newsham, Kitty Brewster",2021.0,39884.0,736249.6
NE25,"E06000057, E08000022",North East,"Northumberland, Tyne and Wear",,"Northumberland, North Tyneside","Holywell, Seghill with Seaton Delaval, Hartley, St Mary's, Monkseaton South, Monkseaton North, Whitley Bay, Collingwood",2021.0,31969.0,519269.8
NE26,"E08000022, E06000057",North East,"Tyne and Wear, Northumberland",,"North Tyneside, Northumberland","Whitley Bay, Collingwood, St Mary's, Monkseaton North, Hartley",2021.0,17468.0,353934.3
NE27,"E08000022, E06000057",North East,"Tyne and Wear, Northumberland",,"North Tyneside, Northumberland","Valley, Killingworth, Holywell, Collingwood",2021.0,15784.0,215877.6
NE28,E08000022,North East,Tyne and Wear,,North Tyneside,"Riverside, Howdon, Collingwood, Wallsend, Northumberland, Battle Hill",2021.0,46474.0,938340.9
NE29,E08000022,North East,Tyne and Wear,,North Tyneside,"Riverside, Preston, Chirton, Collingwood, Cullercoats",2021.0,36924.0,795676.1
NE3,"E08000021, E08000022",North East,Tyne and Wear,,"Newcastle upon Tyne, North Tyneside","Gosforth, Fawdon & West Gosforth, Dene & South Gosforth, Parklands, Kingston Park South & Newbiggin Hall, Castle, Callerton & Throckley, Kenton, Blakelaw, Monument, Weetslade",2021.0,49034.0,914964.8
NE30,E08000022,North East,Tyne and Wear,,North Tyneside,"Tynemouth, Riverside, Preston, Cullercoats, Collingwood",2021.0,19208.0,439609.9
NE31,E08000023,North East,Tyne and Wear,,South Tyneside,"Hebburn North, Hebburn South, Primrose, Monkton, Fellgate and Hedworth",2021.0,24522.0,421738.8
NE32,E08000023,North East,Tyne and Wear,,South Tyneside,"Primrose, Bede, Fellgate and Hedworth, Monkton",2021.0,23090.0,380313.5
NE33,E08000023,North East,Tyne and Wear,,South Tyneside,"Beacon and Bents, Simonside and Rekendyke, Horsley Hill, Westoe, West Park, Biddick and All Saints",2021.0,28836.0,838247.6
NE34,E08000023,North East,Tyne and Wear,,South Tyneside,"Simonside and Rekendyke, Biddick and All Saints, Westoe, West Park, Harton, Cleadon Park, Whiteleas, Bede, Horsley Hill, Whitburn and Marsden, Beacon and Bents, Cleadon and East Boldon",2021.0,49394.0,1070051.1
NE35,E08000023,North East,Tyne and Wear,,South Tyneside,"Primrose, Boldon Colliery",2021.0,7012.0,110672.4
NE36,"E08000023, E08000024",North East,Tyne and Wear,,"South Tyneside, Sunderland","Cleadon and East Boldon, Boldon Colliery, Fellgate and Hedworth, Washington North, Primrose",2021.0,6647.0,79288.3
NE37,"E08000024, E08000023",North East,Tyne and Wear,,"Sunderland, South Tyneside","Washington West, Washington Central, Washington South, Washington North, Fellgate and Hedworth",2021.0,21394.0,349056.0
NE38,"E08000024, E06000047",North East,"Tyne and Wear, County Durham",,"Sunderland, County Durham","Washington South, Washington Central, Washington East, Washington West, North Lodge",2021.0,29780.0,489962.8
NE39,"E08000037, E06000047",North East,"Tyne and Wear, County Durham",,"Gateshead, County Durham","Chopwell and Rowlands Gill, Winlaton and High Spen, Leadgate and Medomsley, Burnopfield and Dipton, Crawcrook and Greenside, Blaydon",2021.0,8006.0,57760.6
NE4,E08000021,North East,Tyne and Wear,,Newcastle upon Tyne,"Arthur's Hill, Monument, Wingrove, Elswick, Benwell & Scotswood, West Fenham",2021.0,39451.0,1178929.0
NE40,E08000037,North East,Tyne and Wear,,Gateshead,"Ryton, Crookhill and Stella, Crawcrook and Greenside, Blaydon",2021.0,14742.0,218181.1
NE41,"E06000057, E08000037",North East,"Northumberland, Tyne and Wear",,"Northumberland, Gateshead","Bywell, Crawcrook and Greenside, Prudhoe North",2021.0,1830.0,13772.5
NE42,"E06000057, E08000037",North East,"Northumberland, Tyne and Wear",,"Northumberland, Gateshead","Prudhoe South, Prudhoe North, Crawcrook and Greenside, South Tynedale, Bywell",2021.0,12053.0,135506.9
NE43,E06000057,North East,Northumberland,,Northumberland,"Bywell, Stocksfield and Broomhaugh, South Tynedale, Prudhoe North",2021.0,4672.0,10301.3
NE44,E06000057,North East,Northumberland,,Northumberland,"Stocksfield and Broomhaugh, Corbridge, South Tynedale",2021.0,1627.0,1920.7
NE45,E06000057,North East,Northumberland,,Northumberland,"Corbridge, Ponteland West",2021.0,3052.0,20334.3
