outcode,district_code,region,county_name,local_authority,District_name,ward_name,most_current_pop_year,population,pop_dens_sq_km
SG19,"E06000056, E07000011, E07000012",East of England,"Bedfordshire, Cambridgeshire",Cambridgeshire,"Central Bedfordshire, Huntingdonshire, South Cambridgeshire","Sandy, Northill, Potton, Great Paxton, Gamlingay, Caldecote, The Mordens",2021.0,24391.0,243877.5
SG2,"E07000243, E07000242, E07000099",East of England,Hertfordshire,Hertfordshire,"Stevenage, East Hertfordshire, North Hertfordshire","Chells, Manor, Bedwell, Roebuck, Aston, Datchworth & Walkern, The Mundens, Bandley Hill, Longmeadow, Weston and Sandon, Martins Wood, Knebworth, Shephall",2021.0,43044.0,713769.3
SG3,"E07000099, E07000241, E07000242",East of England,Hertfordshire,Hertfordshire,"North Hertfordshire, Welwyn Hatfield, East Hertfordshire","Knebworth, Welwyn East, Aston, Datchworth & Walkern, Hertford Rural",2021.0,6167.0,50003.6
SG4,"E07000099, E07000243, E07000241",East of England,Hertfordshire,Hertfordshire,"North Hertfordshire, Stevenage, Welwyn Hatfield","Hitchin Bearton, Hitchin Walsworth, Letchworth South West, Roebuck, Weston and Sandon, Chesfield, Hitchwood, Offa and Hoo, Hitchin Priory, Kimpton, Codicote, Welwyn West, Knebworth, Hitchin Highbury",2021.0,30551.0,351833.2
SG5,"E07000099, E07000243, E06000056",East of England,"Hertfordshire, Bedfordshire",Hertfordshire,"North Hertfordshire, Stevenage, Central Bedfordshire","Hitchin Highbury, Hitchin Bearton, Hitchin Priory, Hitchwood, Offa and Hoo, Hitchin Oughton, Roebuck, Cadwell, Meppershall & Shillington, Clifton, Henlow & Langford, Stotfold, Arlesey & Fairfield",2021.0,31931.0,422016.5
SG6,"E07000099, E06000056",East of England,"Hertfordshire, Bedfordshire",Hertfordshire,"North Hertfordshire, Central Bedfordshire","Letchworth Grange, Letchworth East, Letchworth South West, Letchworth South East, Chesfield, Letchworth Wilbury, Arlesey & Fairfield",2021.0,33658.0,458238.2
SG7,"E07000099, E06000056, E07000012",East of England,"Hertfordshire, Bedfordshire, Cambridgeshire","Hertfordshire, Cambridgeshire","North Hertfordshire, Central Bedfordshire, South Cambridgeshire","Baldock Town, Arbury, Baldock East, Potton, The Mordens, Letchworth East, Ermine, Weston and Sandon",2021.0,14325.0,168857.4
SG8,"E07000012, E06000056, E07000099, E07000077",East of England,"Cambridgeshire, Bedfordshire, Hertfordshire, Essex","Cambridgeshire, Hertfordshire, Essex","South Cambridgeshire, Central Bedfordshire, North Hertfordshire, Uttlesford","The Mordens, Melbourn, Barrington, Caldecote, Potton, Bassingbourn, Royston Palace, Royston Heath, Harston & Comberton, Royston Meridian, Foxton, Whittlesford, Ermine, Littlebury, Chesterford & Wenden Lofts, Clavering",2021.0,39686.0,315920.2
SG9,"E07000242, E07000099",East of England,Hertfordshire,Hertfordshire,"East Hertfordshire, North Hertfordshire","Buntingford, Little Hadham & The Pelhams, Weston and Sandon, Braughing & Standon, Ermine, Ware Priory, The Mundens",2021.0,12389.0,87046.3
SK1,E08000007,North West,Greater Manchester,,Stockport,"Brinnington & Stockport Central, Manor",2021.0,15944.0,370056.2
SK10,E06000049,North West,Cheshire,,Cheshire East,"Macclesfield Central, Macclesfield East, Macclesfield Tytherington, Macclesfield Hurdsfield, Bollington, Broken Cross and Upton, Gawsworth, Macclesfield West and Ivy, Prestbury, Poynton West and Adlington, Poynton East and Pott Shrigley, Chelford, Sutton",2021.0,45002.0,474672.7
SK11,"E06000049, E07000198","North West, West Midlands","Cheshire, Staffordshire",Staffordshire,"Cheshire East, Staffordshire Moorlands","Sutton, Bollington, Macclesfield East, Macclesfield South, Gawsworth, Horton, Dane, Macclesfield Central, Macclesfield West and Ivy, Broken Cross and Upton, Chelford, Dane Valley",2021.0,33876.0,533997.6
SK12,"E06000049, E08000007",North West,"Cheshire, Greater Manchester",,"Cheshire East, Stockport","Poynton West and Adlington, Poynton East and Pott Shrigley, Bramhall South & Woodford, Disley, Marple South & High Lane",2021.0,51554.0,420895.7
SK13,"E07000037, E08000008","East Midlands, North West","Derbyshire, Greater Manchester",Derbyshire,"High Peak, Tameside","Gamesley, Padfield, Tintwistle, Hadfield North, St John's, Hadfield South, Hyde Godley, Whitfield, Simmondley, Sett, Howard Town, Dinting, Old Glossop",2021.0,33788.0,448190.1
SK14,"E08000008, E08000007, E07000037","North West, East Midlands","Greater Manchester, Derbyshire",Derbyshire,"Tameside, Stockport, High Peak","Hyde Godley, Hyde Werneth, Hyde Newton, Marple North, Longdendale, Stalybridge South, Dukinfield, Bredbury & Woodley, Tintwistle",2021.0,51381.0,759661.0
SK15,E08000008,North West,Greater Manchester,,Tameside,"Stalybridge North, Dukinfield Stalybridge, Stalybridge South, Ashton St Michael's, Mossley",2021.0,28257.0,460146.2
SK16,E08000008,North West,Greater Manchester,,Tameside,"Dukinfield, Hyde Godley, Dukinfield Stalybridge",2021.0,18432.0,337578.9
SK17,"E07000035, E07000198, E07000037","East Midlands, West Midlands","Derbyshire, Staffordshire","Derbyshire, Staffordshire","Derbyshire Dales, Staffordshire Moorlands, High Peak","Hartington & Taddington, Manifold, Dane, Burbage, Hamps Valley, Corbar, Buxton Central, Temple, Stone Bench, Barms, Limestone Peak, Bradwell, Hope Valley, Chapel East, Tideswell, Calver & Longstone, Cote Heath, Youlgrave",2021.0,29192.0,324294.3
SK2,E08000007,North West,Greater Manchester,,Stockport,"Manor, Offerton, Hazel Grove, Davenport & Cale Green, Brinnington & Stockport Central, Norbury & Woodsmoor",2021.0,30859.0,573978.8
SK22,"E07000037, E08000007, E06000049","East Midlands, North West","Derbyshire, Greater Manchester, Cheshire",Derbyshire,"High Peak, Stockport, Cheshire East","Sett, New Mills East, Hayfield, New Mills West, Marple South & High Lane, Disley, Chapel East",2021.0,275.0,4299.1
SK23,"E07000037, E06000049","East Midlands, North West","Derbyshire, Cheshire",Derbyshire,"High Peak, Cheshire East","Chapel East, Chapel West, Blackbrook, Hayfield, Whaley Bridge, Poynton East and Pott Shrigley, New Mills West, New Mills East, Limestone Peak",2021.0,228.0,8803.1
SK3,E08000007,North West,Greater Manchester,,Stockport,"Edgeley, Davenport & Cale Green, Brinnington & Stockport Central, Cheadle East & Cheadle Hulme North, Norbury & Woodsmoor",2021.0,28304.0,693741.6
SK4,"E08000007, E08000003",North West,Greater Manchester,,"Stockport, Manchester","Brinnington & Stockport Central, Heatons South, Reddish South, Heatons North, Didsbury East",2021.0,35218.0,657639.0
SK5,"E08000007, E08000008",North West,Greater Manchester,,"Stockport, Tameside","Reddish North, Reddish South, Denton West, Brinnington & Stockport Central",2021.0,29626.0,726063.8
SK6,"E08000007, E06000049",North West,"Greater Manchester, Cheshire",,"Stockport, Cheshire East","Bredbury & Woodley, Bredbury Green & Romiley, Marple North, Marple South & High Lane, Hazel Grove, Disley, Poynton East and Pott Shrigley",2021.0,49031.0,618926.8
SK7,"E08000007, E06000049",North West,"Greater Manchester, Cheshire",,"Stockport, Cheshire East","Bramhall South & Woodford, Handforth, Bramhall North, Norbury & Woodsmoor, Hazel Grove, Offerton, Brinnington & Stockport Central, Marple South & High Lane",2021.0,41485.0,500935.4
SK8,"E08000007, E06000049",North West,"Greater Manchester, Cheshire",,"Stockport, Cheshire East","Cheadle West & Gatley, Cheadle East & Cheadle Hulme North, Heald Green, Cheadle Hulme South, Handforth, Bramhall North, Bramhall South & Woodford",2021.0,59073.0,816428.3
SK9,E06000049,North West,Cheshire,,Cheshire East,"Wilmslow West and Chorley, Wilmslow East, Wilmslow Dean Row, Handforth, Wilmslow Lacey Green, Mobberley, Alderley Edge, Chelford",2021.0,39673.0,436892.6
SL0,"E06000060, E06000039",South East,"Buckinghamshire, Berkshire",,"Buckinghamshire, Slough","Iver, Stoke Poges and Wexham, Denham, Slough Central, Langley Meads",2021.0,12920.0,91673.8
SL1,"E06000039, E06000060",South East,"Berkshire, Buckinghamshire",,"Slough, Buckinghamshire","Slough Central, Chalvey, Herschel Park, Langley St Mary's, Upton, Upton Lea, Cippenham Manor, Farnham, Manor Park & Stoke, Baylis & Salt Hill, Elliman, Northborough & Lynch Hill Valley, Cippenham Village, Cippenham Green, Haymill, Cliveden, Farnham Common and Burnham Beeches, The Wooburns, Bourne End and Hedsor",2021.0,85756.0,1914211.1
SL2,"E06000039, E06000060",South East,"Berkshire, Buckinghamshire",,"Slough, Buckinghamshire","Farnham, Manor Park & Stoke, Britwell, Northborough & Lynch Hill Valley, Slough Central, Cliveden, Farnham Common and Burnham Beeches, Stoke Poges and Wexham, Gerrards Cross, Wexham Court, Elliman, Upton Lea",2021.0,55925.0,1105504.4
SL3,"E06000039, E06000060, E06000040",South East,"Berkshire, Buckinghamshire",,"Slough, Buckinghamshire, Windsor and Maidenhead","Colnbrook & Poyle, Slough Central, Stoke Poges and Wexham, Wexham Court, Langley St Mary's, Langley Meads, Denham, Langley Marish, Upton, Langley Foxborough, Datchet, Horton & Wraysbury, Iver",2021.0,48380.0,830447.2
SL4,"E06000040, E06000036, E07000212, E06000060, E06000039",South East,"Berkshire, Surrey, Buckinghamshire",Surrey,"Windsor and Maidenhead, Bracknell Forest, Runnymede, Buckinghamshire, Slough","Eton & Castle, Old Windsor, Ascot & Sunninghill, Winkfield & Warfield East, Englefield Green West, Clewer East, Clewer & Dedworth East, Bray, Clewer & Dedworth West, Cliveden, Cippenham Village",2021.0,45881.0,639862.6
SL5,"E06000040, E07000212, E06000036, E07000214",South East,"Berkshire, Surrey",Surrey,"Windsor and Maidenhead, Runnymede, Bracknell Forest, Surrey Heath","Ascot & Sunninghill, Sunningdale & Cheapside, Virginia Water, Winkfield & Warfield East, Old Windsor, Swinley Forest, Windlesham & Chobham, Bagshot",2021.0,23095.0,185425.1
SL6,"E06000060, E06000039, E06000040",South East,"Buckinghamshire, Berkshire",,"Buckinghamshire, Slough, Windsor and Maidenhead","Cliveden, The Wooburns, Bourne End and Hedsor, Haymill, Oldfield, St Mary's, Bray, Boyn Hill, Cox Green, Hurley & Walthams, Bisham & Cookham, Pinkneys Green, Belmont, Furze Platt, Riverside",2021.0,80544.0,1062923.2
SL60,E06000040,South East,Berkshire,,Windsor and Maidenhead,Oldfield,,,
SL7,"E06000060, E06000040",South East,"Buckinghamshire, Berkshire",,"Buckinghamshire, Windsor and Maidenhead","Marlow, Flackwell Heath, Little Marlow and Marlow South East, Bisham & Cookham, Chiltern Villages",2021.0,20047.0,227075.6
SL8,"E06000060, E06000040",South East,"Buckinghamshire, Berkshire",,"Buckinghamshire, Windsor and Maidenhead","The Wooburns, Bourne End and Hedsor, Flackwell Heath, Little Marlow and Marlow South East, Bisham & Cookham",2021.0,6431.0,71911.6
SL9,"E06000060, E07000102","South East, East of England","Buckinghamshire, Hertfordshire",Hertfordshire,"Buckinghamshire, Three Rivers","Chalfont St Peter, Gerrards Cross, Denham, Chorleywood South & Maple Cross, Chalfont St Giles",2021.0,22427.0,161479.3
SL95,E06000039,South East,Berkshire,,Slough,"Slough Central, Langley Foxborough",,,
SM1,E09000029,London,Greater London,,Sutton,"Sutton Central, Sutton North, Sutton West & East Cheam, Sutton South, Stonecot, Cheam, The Wrythe, St Helier West, Carshalton Central",2021.0,48824.0,1458999.5
SM2,"E09000029, E07000211, E07000208","London, South East","Greater London, Surrey",Surrey,"Sutton, Reigate and Banstead, Epsom and Ewell","Sutton South, Belmont, Banstead Village, Sutton Central, Cheam, Sutton West & East Cheam, Nonsuch",2021.0,30153.0,790907.0
SM3,"E09000029, E07000208, E09000024","London, South East","Greater London, Surrey",Surrey,"Sutton, Epsom and Ewell, Merton","Cheam, Nonsuch, North Cheam, Worcester Park South, Stonecot, Lower Morden, Sutton Central",2021.0,20138.0,394406.4
SM4,"E09000024, E09000029",London,Greater London,,"Merton, Sutton","Lower Morden, Cannon Hill, Merton Park, St Helier, Figge's Marsh, Ravensbury, St Helier East, St Helier West",2021.0,40362.0,880794.0
SM5,"E09000029, E07000211","London, South East","Greater London, Surrey",Surrey,"Sutton, Reigate and Banstead","St Helier West, St Helier East, Wallington North, The Wrythe, Carshalton Central, Hackbridge, Wallington South, Carshalton South & Clockhouse, Banstead Village",2021.0,40498.0,911928.7
SM6,E09000029,London,Greater London,,Sutton,"Wallington North, Wallington South, South Beddington & Roundshaw, Carshalton South & Clockhouse, Hackbridge, Beddington",2021.0,34752.0,967374.1
SM7,"E07000211, E09000029","South East, London","Surrey, Greater London",Surrey,"Reigate and Banstead, Sutton","Nork, Banstead Village, Cheam, Chipstead, Kingswood & Woodmansterne, Carshalton South & Clockhouse",2021.0,16476.0,165006.0
SN1,E06000030,South West,Wiltshire,,Swindon,"Central, Rodbourne Cheney, Eastcott, Covingham and Dorcan, St Margaret and South Marston, Walcot and Park North, Old Town, Wroughton and Wichelstowe",2021.0,39130.0,1067992.9
SN10,E06000054,South West,Wiltshire,,Wiltshire,"Devizes North, Devizes South, Bromham, Rowde & Roundway, Devizes Rural West, Urchfont & Bishops Cannings, Devizes East, Pewsey Vale West, The Lavingtons",2021.0,33247.0,273346.8
SN11,E06000054,South West,Wiltshire,,Wiltshire,"Calne South, Calne Central, Calne Chilvester & Abberd, Calne Rural, Calne North, Lyneham",2021.0,27087.0,321979.0
SN12,E06000054,South West,Wiltshire,,Wiltshire,"Melksham South, Melksham Without West & Rural, Bowerhill, Devizes Rural West, Melksham East, Melksham Forest, Melksham Without North & Shurnhold, Holt, Box & Colerne",2021.0,28714.0,333118.5
SN13,E06000054,South West,Wiltshire,,Wiltshire,"Corsham Ladbrook, Corsham Pickwick, Corsham Without, Box & Colerne, Kington, Chippenham Cepen Park & Derriads, Holt, Winsley & Westwood",2021.0,18762.0,158624.7
SN14,"E06000054, E06000025",South West,"Wiltshire, Gloucestershire",,"Wiltshire, South Gloucestershire","Chippenham Sheldon, Chippenham Cepen Park & Hunters Moon, Chippenham Cepen Park & Derriads, Chippenham Lowden & Rowden, Kington, Corsham Without, By Brook, Sherston, Chippenham Hardenhuish, Boyd Valley, Box & Colerne",2021.0,29379.0,287235.1
SN15,E06000054,South West,Wiltshire,,Wiltshire,"Chippenham Hardens & Central, Chippenham Hardenhuish, Chippenham Monkton, Chippenham Lowden & Rowden, Chippenham Cepen Park & Derriads, Chippenham Sheldon, Corsham Without, Bromham, Rowde & Roundway, Bowerhill, Chippenham Cepen Park & Hunters Moon, Melksham Without North & Shurnhold, Calne South, Calne Rural, Chippenham Pewsham, Lyneham, Brinkworth, Kington, Royal Wootton Bassett South & West, Royal Wootton Bassett East",2021.0,32665.0,312399.0
SN16,"E06000054, E07000079",South West,"Wiltshire, Gloucestershire",Gloucestershire,"Wiltshire, Cotswold","Malmesbury, Sherston, By Brook, Tetbury East & Rural, Royal Wootton Bassett South & West, Minety, Brinkworth, Purton",2021.0,14457.0,66267.9
SN2,E06000030,South West,Wiltshire,,Swindon,"Gorse Hill and Pinehurst, Rodbourne Cheney, Covingham and Dorcan, Mannington and Western, Haydon Wick, Priory Vale, Penhill and Upper Stratton, Eastcott",2021.0,70245.0,1215348.8
SN25,"E06000030, E06000054",South West,Wiltshire,,"Swindon, Wiltshire","Priory Vale, Haydon Wick, St Andrews, Purton, Gorse Hill and Pinehurst, Rodbourne Cheney, Covingham and Dorcan, Penhill and Upper Stratton, Blunsdon and Highworth",2021.0,21556.0,578039.8
SN26,E06000030,South West,Wiltshire,,Swindon,"Blunsdon and Highworth, St Andrews",,,
SN3,E06000030,South West,Wiltshire,,Swindon,"Ridgeway, Walcot and Park North, Central, Liden, Eldene and Park South, Chiseldon and Lawn, Old Town, Covingham and Dorcan, St Margaret and South Marston, Blunsdon and Highworth, Penhill and Upper Stratton",2021.0,54671.0,858866.1
SN38,E06000030,South West,Wiltshire,,Swindon,"Central, Old Town, Shaw, Covingham and Dorcan, Lydiard and Freshbrook",2021.0,962.0,3866.4
SN4,"E06000030, E06000054",South West,Wiltshire,,"Swindon, Wiltshire","Ridgeway, Chiseldon and Lawn, Royal Wootton Bassett South & West, Wroughton and Wichelstowe, Royal Wootton Bassett North, Lyneham, Royal Wootton Bassett East, Marlborough West",2021.0,27458.0,281338.7
SN5,"E06000054, E06000030",South West,Wiltshire,,"Wiltshire, Swindon","Purton, Royal Wootton Bassett East, Brinkworth, Mannington and Western, Lydiard and Freshbrook, Cricklade & Latton, Shaw, Central",2021.0,33644.0,503914.9
SN6,"E06000054, E06000030, E07000079, E07000180","South West, South East","Wiltshire, Gloucestershire, Oxfordshire","Gloucestershire, Oxfordshire","Wiltshire, Swindon, Cotswold, Vale of White Horse","Cricklade & Latton, Minety, Blunsdon and Highworth, The Ampneys & Hampton, Mannington and Western, Watchfield & Shrivenham, Ridgeway",2021.0,21429.0,167043.0
SN7,E07000180,South East,Oxfordshire,Oxfordshire,Vale of White Horse,"Faringdon, Stanford, Watchfield & Shrivenham, Ridgeway, Thames, Kingston Bagpuize",2021.0,14136.0,115323.2
SN8,"E06000054, E06000030, E06000037","South West, South East","Wiltshire, Berkshire",,"Wiltshire, Swindon, West Berkshire","Marlborough West, Marlborough East, Aldbourne & Ramsbury, Urchfont & Bishops Cannings, Ridgeway, Pewsey Vale East, Lambourn, Ludgershall North & Rural, Pewsey Vale West, Pewsey",2021.0,24828.0,112254.0
SN9,E06000054,South West,Wiltshire,,Wiltshire,"Pewsey, Pewsey Vale West, Marlborough West, Avon Valley",2021.0,7506.0,25835.4
SN99,E06000030,South West,Wiltshire,,Swindon,Covingham and Dorcan,,,
SO14,E06000045,South East,Hampshire,,Southampton,"Bargate, Bevois, Bitterne Park, Banister & Polygon, Portswood",2021.0,15393.0,636471.1
SO15,E06000045,South East,Hampshire,,Southampton,"Freemantle, Millbrook, Redbridge, Bargate, Banister & Polygon, Shirley, Bassett",2021.0,808.0,42257.3
SO16,"E07000093, E06000045",South East,Hampshire,Hampshire,"Test Valley, Southampton","Chilworth, Nursling & Rownhams, Redbridge, Swaythling, Bassett, Freemantle, Millbrook, Shirley, Coxford, Portswood",2021.0,15020.0,289116.4
SO17,E06000045,South East,Hampshire,,Southampton,"Portswood, Banister & Polygon, Bevois, Freemantle, Swaythling, Bassett",2021.0,15656.0,431620.5
SO18,"E06000045, E07000086",South East,Hampshire,Hampshire,"Southampton, Eastleigh","Bitterne Park, Peartree, Harefield, Swaythling, Eastleigh South, West End South, West End North, Thornhill, Bargate",2021.0,40584.0,757301.7
SO19,"E06000045, E07000086",South East,Hampshire,Hampshire,"Southampton, Eastleigh","Thornhill, Sholing, Bursledon & Hound North, Peartree, Bitterne Park, Harefield, West End South, Hedge End South, Woolston",2021.0,56891.0,1298434.1
SO20,"E07000093, E07000094",South East,Hampshire,Hampshire,"Test Valley, Winchester","Harewood, Mid Test, St Bartholomew",2021.0,9533.0,22171.0
SO21,"E07000094, E07000086, E07000093, E07000084",South East,Hampshire,Hampshire,"Winchester, Eastleigh, Test Valley, Basingstoke and Deane","The Worthys, Alresford and Itchen Valley, Colden Common and Twyford, Upper Meon Valley, St Michael, St Bartholomew, Badger Farm and Oliver's Battery, Wonston and Micheldever, Eastleigh North, Ampfield & Braishfield, Whitchurch, Overton & Laverstoke, Oakley & The Candovers, Harewood",2021.0,24847.0,67771.1
SO22,E07000094,South East,Hampshire,Hampshire,Winchester,"St Luke, St Paul, Badger Farm and Oliver's Battery, St Bartholomew, St Barnabas, Wonston and Micheldever, The Worthys",2021.0,33113.0,425951.8
SO23,E07000094,South East,Hampshire,Hampshire,Winchester,"St Bartholomew, St Michael, St Paul, The Worthys, Alresford and Itchen Valley, Badger Farm and Oliver's Battery",2021.0,19618.0,312788.2
SO24,"E07000094, E07000085, E07000084",South East,Hampshire,Hampshire,"Winchester, East Hampshire, Basingstoke and Deane","Alresford and Itchen Valley, Upper Meon Valley, Ropley, Hawkley & Hangers, Four Marks & Medstead, Oakley & The Candovers, Bentworth & Froyle",2021.0,9448.0,53301.0
SO25,E07000094,South East,Hampshire,Hampshire,Winchester,St Bartholomew,,,
SO30,"E07000086, E07000094",South East,Hampshire,Hampshire,"Eastleigh, Winchester","Hedge End South, Bursledon & Hound North, Botley, Hedge End North, Whiteley and Shedfield, West End North, Fair Oak & Horton Heath, West End South",2021.0,3447.0,82429.9
SO31,"E07000087, E07000086",South East,Hampshire,Hampshire,"Fareham, Eastleigh","Park Gate, Bursledon & Hound North, Sarisbury, Hedge End South, Hamble & Netley, Titchfield Common, Locks Heath, Warsash",2021.0,1701.0,28102.5
SO32,"E07000094, E07000086",South East,Hampshire,Hampshire,"Winchester, Eastleigh","Bishop's Waltham, Central Meon Valley, Upper Meon Valley, Fair Oak & Horton Heath, Whiteley and Shedfield, Botley, Southwick and Wickham",2021.0,1469.0,14726.2
SO40,E07000091,South East,Hampshire,Hampshire,New Forest,"Totton North, Lyndhurst & Minstead, Ashurst, Bramshaw, Copythorne & Netley Marsh, Totton South, Totton Central, Marchwood & Eling, Brockenhurst & Denny Lodge, Dibden & Dibden Purlieu",2021.0,744.0,12212.8
SO41,E07000091,South East,Hampshire,Hampshire,New Forest,"Milford & Hordle, Sway, Barton & Becton, Lymington, Forest & Solent, Pennington, Brockenhurst & Denny Lodge",2021.0,738.0,12272.6
SO42,E07000091,South East,Hampshire,Hampshire,New Forest,"Brockenhurst & Denny Lodge, Forest & Solent, Lymington",,,
SO43,E07000091,South East,Hampshire,Hampshire,New Forest,"Lyndhurst & Minstead, Ashurst, Bramshaw, Copythorne & Netley Marsh, Totton North",,,
SO45,E07000091,South East,Hampshire,Hampshire,New Forest,"Fawley, Blackfield, Calshot & Langley, Forest & Solent, Hardley, Holbury & North Blackfield, Hythe Central, Brockenhurst & Denny Lodge, Hythe South, Dibden & Dibden Purlieu",2021.0,132.0,4230.8
SO50,"E07000086, E07000094, E07000093",South East,Hampshire,Hampshire,"Eastleigh, Winchester, Test Valley","Eastleigh North, Eastleigh South, Eastleigh Central, Badger Farm and Oliver's Battery, Bishopstoke, Colden Common and Twyford, Fair Oak & Horton Heath, West End North, Chilworth, Nursling & Rownhams",2021.0,1966.0,60244.8
SO51,"E07000093, E07000094, E07000091, E06000054","South East, South West","Hampshire, Wiltshire",Hampshire,"Test Valley, Winchester, New Forest, Wiltshire","Mid Test, Romsey Cupernham, Blackwater, Ampfield & Braishfield, Romsey Abbey, Badger Farm and Oliver's Battery, Romsey Tadburn, Chilworth, Nursling & Rownhams, Ashurst, Bramshaw, Copythorne & Netley Marsh, Alderbury & Whiteparish, North Baddesley",2021.0,2864.0,38954.4
SO52,E07000093,South East,Hampshire,Hampshire,Test Valley,"North Baddesley, Valley Park, Ampfield & Braishfield, Chilworth, Nursling & Rownhams",,,
SO53,"E07000086, E07000093, E07000094",South East,Hampshire,Hampshire,"Eastleigh, Test Valley, Winchester","Hiltingbury, Chandler's Ford, Eastleigh North, Eastleigh South, Chilworth, Nursling & Rownhams, Valley Park, North Baddesley, Ampfield & Braishfield, Badger Farm and Oliver's Battery",2021.0,3288.0,38656.2
SO97,E07000086,South East,Hampshire,Hampshire,Eastleigh,Eastleigh South,,,
SP1,E06000054,South West,Wiltshire,,Wiltshire,"Laverstock, Salisbury St Edmund's, Salisbury Milford, Salisbury Harnham East, Salisbury St Francis & Stratford, Salisbury St Paul's, Old Sarum & Lower Bourne Valley",2021.0,23801.0,344905.3
SP10,E07000093,South East,Hampshire,Hampshire,Test Valley,"Andover St Mary's, Andover Winton, Anna, Andover Millway, Andover Harroway, Charlton & the Pentons, Bourne Valley, Andover Romans, Andover Downlands",2021.0,42285.0,580206.3
SP11,"E07000093, E07000084, E06000054","South East, South West","Hampshire, Wiltshire",Hampshire,"Test Valley, Basingstoke and Deane, Wiltshire","Bourne Valley, Anna, Charlton & the Pentons, Evingar, Bellinger, Ludgershall North & Rural, Andover Romans, Andover Downlands, Andover Winton, Andover St Mary's, Harewood, Andover Millway, Tidworth East & Ludgershall South, Pewsey Vale East, Tidworth North & West",2021.0,32334.0,249471.4
SP2,E06000054,South West,Wiltshire,,Wiltshire,"Till Valley, Wilton, Fovant & Chalke Valley, Salisbury St Edmund's, Salisbury St Paul's, Salisbury Fisherton & Bemerton Village, Salisbury Harnham East, Salisbury Harnham West, Downton & Ebble Valley, Salisbury Bemerton Heath",2021.0,31154.0,452096.0
SP3,E06000054,South West,Wiltshire,,Wiltshire,"Fovant & Chalke Valley, Nadder Valley, Till Valley, Tisbury, Wylye Valley",2021.0,12246.0,26704.5
SP4,"E06000054, E07000093","South West, South East","Wiltshire, Hampshire",Hampshire,"Wiltshire, Test Valley","Winterslow & Upper Bourne Valley, Anna, Bellinger, Amesbury East & Bulford, Old Sarum & Lower Bourne Valley, Salisbury St Edmund's, Till Valley, Salisbury St Francis & Stratford, Alderbury & Whiteparish, Amesbury West, Amesbury South, Durrington, Avon Valley",2021.0,37649.0,335735.2
SP5,"E06000054, E07000093, E07000091, E06000059","South West, South East","Wiltshire, Hampshire, Dorset",Hampshire,"Wiltshire, Test Valley, New Forest, Dorset","Alderbury & Whiteparish, Mid Test, Winterslow & Upper Bourne Valley, Salisbury St Edmund's, Redlynch & Landford, Ashurst, Bramshaw, Copythorne & Netley Marsh, Downlands & Forest North, Salisbury Milford, Downton & Ebble Valley, Fovant & Chalke Valley, Salisbury Harnham West, Beacon, Cranborne Chase, Tisbury, Hill Forts & Upper Tarrants, Cranborne & Alderholt",2021.0,21572.0,40635.1
SP6,"E07000091, E06000059, E06000054","South East, South West","Hampshire, Dorset, Wiltshire",Hampshire,"New Forest, Dorset, Wiltshire","Fordingbridge, Godshill & Hyde, Downlands & Forest North, Cranborne & Alderholt, Ringwood North & Ellingham, Downton & Ebble Valley",2021.0,13112.0,81028.0
SP7,"E06000059, E06000054",South West,"Dorset, Wiltshire",,"Dorset, Wiltshire","Beacon, Tisbury, Fovant & Chalke Valley, Shaftesbury Town, Gillingham, Nadder Valley",2021.0,14784.0,116506.2
SP8,E06000059,South West,Dorset,,Dorset,"Gillingham, Beacon",2021.0,13818.0,138428.3
SP9,"E06000054, E07000093","South West, South East","Wiltshire, Hampshire",Hampshire,"Wiltshire, Test Valley","Tidworth North & West, Tidworth East & Ludgershall South, Ludgershall North & Rural, Bellinger",2021.0,11264.0,112345.8
SR1,E08000024,North East,Tyne and Wear,,Sunderland,"Hendon, Millfield, St Michael's",2021.0,10401.0,184438.0
