outcode,district_code,region,county_name,local_authority,District_name,ward_name,most_current_pop_year,population,pop_dens_sq_km
AL1,E07000240,East of England,Hertfordshire,Hertfordshire,St Albans,"Sopwell, Cunningham, St Peters, Verulam, Hill End, Bernards Heath, Marshalswick West, Clarence",2021.0,41625.0,787001.0
AL10,E07000241,East of England,Hertfordshire,Hertfordshire,Welwyn Hatfield,"Hatfield Central, Hatfield East, Hatfield South West, Welham Green and Hatfield South, Hatfield Villages",2021.0,40387.0,694279.2
AL2,"E07000240, E07000098",East of England,Hertfordshire,Hertfordshire,"St Albans, Hertsmere","London Colney, Park Street, Shenley, Cunningham, Hill End, St Stephen, Aldenham West, Sopwell, Verulam",2021.0,25590.0,239869.1
AL3,"E07000240, E07000096, E06000056",East of England,Hertfordshire,Hertfordshire,"St Albans, Dacorum, Central Bedfordshire","Verulam, St Peters, Hill End, Bernards Heath, Batchwood, Redbourn, Sandridge & Wheathampstead, Harpenden South, Watling, Harpenden North & Rural, Caddington",2021.0,29631.0,345059.2
AL4,"E07000240, E07000241, E07000098, E07000099",East of England,Hertfordshire,Hertfordshire,"St Albans, Welwyn Hatfield, Hertsmere, North Hertfordshire","Cunningham, Hill End, Colney Heath, Marshalswick East & Jersey Farm, Marshalswick West, London Colney, Welham Green and Hatfield South, Shenley, Hatfield Villages, Sandridge & Wheathampstead, Kimpton",2021.0,27195.0,321322.7
AL5,"E07000240, E06000056",East of England,Hertfordshire,Hertfordshire,"St Albans, Central Bedfordshire","Sandridge & Wheathampstead, Harpenden South, Harpenden East, Harpenden West, Hill End, Redbourn, Harpenden North & Rural, Caddington",2021.0,31030.0,367292.4
AL6,"E07000242, E07000241, E07000099, E07000240",East of England,Hertfordshire,Hertfordshire,"East Hertfordshire, Welwyn Hatfield, North Hertfordshire, St Albans","Hertford Rural, Welwyn East, Welwyn West, Sherrards, Aston, Datchworth & Walkern, Panshanger, Knebworth, Peartree, Handside, Codicote, Sandridge & Wheathampstead",2021.0,14712.0,60091.7
AL7,E07000241,East of England,Hertfordshire,Hertfordshire,Welwyn Hatfield,"Peartree, Haldens, Welwyn East, Panshanger, Howlands, Hollybush, Hatfield East, Handside",2021.0,36806.0,694769.9
AL8,E07000241,East of England,Hertfordshire,Hertfordshire,Welwyn Hatfield,"Handside, Peartree, Sherrards, Hatfield Villages",2021.0,12553.0,146753.4
AL9,"E07000241, E07000242",East of England,Hertfordshire,Hertfordshire,"Welwyn Hatfield, East Hertfordshire","Hatfield East, Hatfield Central, Brookmans Park and Little Heath, Welham Green and Hatfield South, Hertford Rural",2021.0,10504.0,68598.3
B1,E08000025,West Midlands,,,Birmingham,"Ladywood, Bordesley & Highgate, Newtown, Soho & Jewellery Quarter",2021.0,14350.0,868488.9
B10,E08000025,West Midlands,,,Birmingham,"Bordesley Green, Sparkbrook & Balsall Heath East, Small Heath, Bordesley & Highgate, Heartlands",2021.0,32876.0,838990.7
B11,E08000025,West Midlands,,,Birmingham,"Sparkbrook & Balsall Heath East, Bordesley & Highgate, Tyseley & Hay Mills, Acocks Green, Sparkhill, Hall Green North",2021.0,51322.0,1600621.2
B12,E08000025,West Midlands,,,Birmingham,"Bordesley & Highgate, Sparkbrook & Balsall Heath East, Balsall Heath West, Tyseley & Hay Mills, Sparkhill, Moseley",2021.0,23576.0,854739.5
B13,E08000025,West Midlands,,,Birmingham,"Brandwood & King's Heath, Billesley, Moseley, Hall Green North, Stirchley, Sparkbrook & Balsall Heath East, Sparkhill",2021.0,39037.0,671004.1
B14,"E08000025, E08000029, E07000234",West Midlands,Worcestershire,Worcestershire,"Birmingham, Solihull, Bromsgrove","Billesley, Highter's Heath, Shirley West, Druids Heath & Monyhull, Brandwood & King's Heath, King's Norton South, Wythall West, Hollywood, Moseley",2021.0,42858.0,831636.6
B15,E08000025,West Midlands,,,Birmingham,"Ladywood, Edgbaston, Soho & Jewellery Quarter, Bournbrook & Selly Park, Harborne",2021.0,25034.0,603460.0
B16,"E08000025, E08000028",West Midlands,,,"Birmingham, Sandwell","North Edgbaston, Ladywood, Soho and Victoria, Edgbaston",2021.0,25024.0,1125927.1
B17,E08000025,West Midlands,,,Birmingham,"Harborne, Edgbaston, Quinton, North Edgbaston",2021.0,28352.0,577212.3
B18,"E08000025, E08000028",West Midlands,,,"Birmingham, Sandwell","North Edgbaston, Soho & Jewellery Quarter, Soho and Victoria, Newtown, Ladywood",2021.0,20147.0,541903.7
B19,E08000025,West Midlands,,,Birmingham,"Lozells, Soho & Jewellery Quarter, Handsworth, Newtown, Birchfield, Aston",2021.0,26749.0,838146.0
B2,E08000025,West Midlands,,,Birmingham,"Newtown, Ladywood",2021.0,684.0,11710.9
B20,E08000025,West Midlands,,,Birmingham,"Handsworth Wood, Handsworth, Birchfield, Aston, Lozells",2021.0,39964.0,846042.1
B21,"E08000025, E08000028",West Midlands,,,"Birmingham, Sandwell","Handsworth Wood, Holyhead, Soho & Jewellery Quarter, Lozells, West Bromwich Central, Handsworth",2021.0,27351.0,707185.3
B23,E08000025,West Mid-lands,,,Birmingham,"Erdington, Perry Common, Sutton Vesey, Gravelly Hill, Stockland Green, Perry Barr",2021.0,53316.0,1164959.1
B24,E08000025,West Midlands,,,Birmingham,"Erdington, Pype Hayes, Gravelly Hill, Nechells",2021.0,29837.0,499727.0
B25,E08000025,West Midlands,,,Birmingham,"South Yardley, Tyseley & Hay Mills, Yardley West & Stechford, Yardley East",2021.0,18553.0,386719.1
B26,"E08000025, E08000029",West Midlands,,,"Birmingham, Solihull","South Yardley, Sheldon, Yardley East, Lyndon, Garretts Green, Bickenhill, Tyseley & Hay Mills, Elmdon",2021.0,37121.0,689549.7
B27,"E08000025, E08000029",West Midlands,,,"Birmingham, Solihull","Acocks Green, Tyseley & Hay Mills, Olton, Lyndon, South Yardley",2021.0,28600.0,576246.9
B28,"E08000025, E08000029",West Midlands,,,"Birmingham, Solihull","Hall Green North, Hall Green South, Billesley, Tyseley & Hay Mills, Acocks Green, Olton",2021.0,30141.0,509323.7
B29,E08000025,West Midlands,,,Birmingham,"Weoley & Selly Oak, Bartley Green, Allens Cross, Bournville & Cotteridge, Bournbrook & Selly Park, Edgbaston",2021.0,47674.0,1199742.4
B3,E08000025,West Midlands,,,Birmingham,"Soho & Jewellery Quarter, Ladywood, Newtown",2021.0,1515.0,93677.5
B30,E08000025,West Midlands,,,Birmingham,"Bournville & Cotteridge, Bournbrook & Selly Park, Stirchley, Druids Heath & Monyhull, King's Norton North, King's Norton South",2021.0,29517.0,511223.3
B31,"E08000025, E07000234",West Midlands,Worcestershire,Worcestershire,"Birmingham, Bromsgrove","Bartley Green, Allens Cross, Northfield, Weoley & Selly Oak, Bournville & Cotteridge, Longbridge & West Heath, King's Norton North, Cofton, Barnt Green & Hopwood, Frankley Great Park, Belbroughton & Romsley",2021.0,58581.0,1026604.4
B32,"E08000025, E07000234",West Midlands,Worcestershire,Worcestershire,"Birmingham, Bromsgrove","Quinton, Harborne, Bartley Green, Weoley & Selly Oak, Belbroughton & Romsley",2021.0,38096.0,700993.4
B33,E08000025,West Midlands,,,Birmingham,"Glebe Farm & Tile Cross, Garretts Green, Sheldon, Yardley West & Stechford, Yardley East",2021.0,35818.0,636306.5
B34,E08000025,West Midlands,,,Birmingham,"Bromford & Hodge Hill, Glebe Farm & Tile Cross, Shard End",2021.0,20920.0,360194.8
B35,E08000025,West Midlands,,,Birmingham,"Pype Hayes, Castle Vale",2021.0,8864.0,188616.9
B36,"E08000029, E08000025",West Midlands,,,"Solihull, Birmingham","Castle Bromwich, Smith's Wood, Castle Vale, Kingshurst and Fordbridge, Bromford & Hodge Hill",2021.0,37689.0,787632.3
B37,"E08000029, E08000025",West Midlands,,,"Solihull, Birmingham","Kingshurst and Fordbridge, Glebe Farm & Tile Cross, Chelmsley Wood, Bickenhill, Smith's Wood",2021.0,35681.0,754714.3
B38,"E08000025, E07000234",West Midlands,Worcestershire,Worcestershire,"Birmingham, Bromsgrove","King's Norton South, Wythall West, Barnt Green & Hopwood, King's Norton North, Longbridge & West Heath, Bournville & Cotteridge",2021.0,18582.0,317725.3
B4,E08000025,West Midlands,,,Birmingham,"Ladywood, Newtown, Soho & Jewellery Quarter, Nechells, Sutton Trinity, Bordesley & Highgate",2021.0,8069.0,66124.9
B40,E08000029,West Midlands,,,Solihull,"Bickenhill, Chelmsley Wood",,,
B42,"E08000025, E08000028",West Midlands,,,"Birmingham, Sandwell","Perry Barr, Handsworth Wood, Newton, Sutton Four Oaks, Oscott, Aston, Kingstanding",2021.0,28606.0,493594.2
B43,"E08000028, E08000025, E08000030",West Midlands,,,"Sandwell, Birmingham, Walsall","Newton, Great Barr with Yew Tree, Charlemont with Grove Vale, Perry Barr, Paddock, Pheasey Park Farm, Oscott",2021.0,30647.0,492098.7
B44,E08000025,West Midlands,,,Birmingham,"Kingstanding, Perry Common, Stockland Green, Sutton Vesey, Perry Barr, Oscott",2021.0,33694.0,698636.4
B45,"E08000025, E07000234",West Midlands,Worcestershire,Worcestershire,"Birmingham, Bromsgrove","Frankley Great Park, Belbroughton & Romsley, Rubery & Rednal, Cofton, Longbridge & West Heath, Barnt Green & Hopwood, Lickey Hills, Marlbrook, Rubery South, Rubery North",2021.0,32327.0,507101.3
B46,E07000218,West Midlands,Warwickshire,Warwickshire,North Warwickshire,"Coleshill North, Curdworth, Coleshill South, Water Orton, Fillongley, Arley and Whitacre",2021.0,14365.0,126747.8
B47,"E07000234, E08000025, E07000221",West Midlands,"Worcestershire, Warwickshire","Worcestershire, Warwickshire","Bromsgrove, Birmingham, Stratford-on-Avon","Hollywood, Drakes Cross, Highter's Heath, Wythall East, Wythall West, Tanworth-in-Arden, Alvechurch South, Billesley",2021.0,10719.0,111743.1
B48,"E07000234, E07000221",West Midlands,"Worcestershire, Warwickshire","Worcestershire, Warwickshire","Bromsgrove, Stratford-on-Avon","Barnt Green & Hopwood, Alvechurch Village, Alvechurch South, Tardebigge, Wythall West, Tanworth-in-Arden",2021.0,5501.0,48236.7
B49,"E07000221, E07000238",West Midlands,"Warwickshire, Worcestershire","Warwickshire, Worcestershire","Stratford-on-Avon, Wychavon","Alcester West, Salford Priors & Alcester Rural, Alcester East, Studley South, Inkberrow, Kinwarton, Wootton Wawen, Welford-on-Avon",2021.0,12436.0,74617.6
B5,E08000025,West Midlands,,,Birmingham,"Ladywood, Bordesley & Highgate, Newtown, Nechells, Balsall Heath West, Edgbaston",2021.0,9345.0,420629.4
B50,"E07000221, E07000238",West Midlands,"Warwickshire, Worcestershire","Warwickshire, Worcestershire","Stratford-on-Avon, Wychavon","Bidford East, Bidford West, Salford Priors & Alcester Rural, Honeybourne, Pebworth & The Littletons",2021.0,7316.0,63013.9
B6,E08000025,West Midlands,,,Birmingham,"Newtown, Nechells, Aston, Perry Barr",2021.0,18643.0,505273.6
B60,"E07000234, E07000238",West Midlands,Worcestershire,Worcestershire,"Bromsgrove, Wychavon","Lowes Hill, Bromsgrove Central, Lickey Hills, Tardebigge, Marlbrook, Slideslow, Norton, Cofton, Aston Fields, Sanders Park, Avoncroft, Charford, Rock Hill, Dodderhill, Inkberrow, Sidemoor",2021.0,31708.0,337007.6
B61,"E07000234, E07000238",West Midlands,Worcestershire,Worcestershire,"Bromsgrove, Wychavon","Aston Fields, Lowes Hill, Sidemoor, Perryfields, Catshill South, Belbroughton & Romsley, Norton, Catshill North, Marlbrook, Rubery South, Sanders Park, Hill Top, Bromsgrove Central, Dodderhill, Rock Hill, Avoncroft, Charford",2021.0,23802.0,321747.3
B62,"E08000027, E07000234, E08000025, E08000028",West Midlands,Worcestershire,Worcestershire,"Dudley, Bromsgrove, Birmingham, Sandwell","Halesowen South, Belbroughton & Romsley, Bartley Green, Hayley Green and Cradley South, Halesowen North, Belle Vale, Cradley Heath and Old Hill",2021.0,27378.0,348279.2
B63,E08000027,West Midlands,,,Dudley,"Hayley Green and Cradley South, Belle Vale, Cradley and Wollescote, Halesowen South, Halesowen North",2021.0,36475.0,581168.7
B64,"E08000028, E08000027",West Midlands,,,"Sandwell, Dudley","Cradley Heath and Old Hill, Rowley, Halesowen North, Netherton, Woodside and St Andrews, Blackheath",2021.0,19902.0,320736.2
B65,"E08000028, E08000027",West Midlands,,,"Sandwell, Dudley","Blackheath, Langley, Halesowen North, Rowley, Tividale",2021.0,25806.0,496763.5
B66,"E08000028, E08000025",West Midlands,,,"Sandwell, Birmingham","Smethwick, St Pauls, Soho and Victoria, Holyhead, Soho & Jewellery Quarter, Abbey",2021.0,31802.0,773889.5
B67,E08000028,West Midlands,,,Sandwell,"Abbey, Bristnall, Smethwick, Soho and Victoria, St Pauls",2021.0,27052.0,643202.4
B68,E08000028,West Midlands,,,Sandwell,"Old Warley, Langley, Bristnall, St Pauls, Abbey, Smethwick",2021.0,31940.0,595299.6
B69,E08000028,West Midlands,,,Sandwell,"Tividale, Langley, Rowley, Oldbury, St Pauls",2021.0,29524.0,512987.7
B7,E08000025,West Midlands,,,Birmingham,"Nechells, Gravelly Hill",2021.0,8801.0,255304.4
B70,E08000028,West Midlands,,,Sandwell,"Greets Green and Lyng, Great Bridge, Wednesbury South, Hateley Heath, West Bromwich Central",2021.0,35265.0,567319.5
B71,E08000028,West Midlands,,,Sandwell,"Charlemont with Grove Vale, Hateley Heath, West Bromwich Central, Wednesbury South, Newton, St Pauls",2021.0,32012.0,577466.9
B72,E08000025,West Midlands,,,Birmingham,"Sutton Wylde Green, Erdington, Sutton Trinity",2021.0,13036.0,145676.2
B73,E08000025,West Midlands,,,Birmingham,"Perry Common, Sutton Vesey, Sutton Wylde Green, Erdington, Sutton Trinity",2021.0,20404.0,275772.7
B74,"E08000025, E08000030, E07000194",West Midlands,Staffordshire,Staffordshire,"Birmingham, Walsall, Lichfield","Sutton Vesey, Streetly, Sutton Trinity, Sutton Four Oaks, Sutton Mere Green, Little Aston & Stonnall",2021.0,32997.0,378596.0
B75,"E08000025, E07000194, E07000218",West Midlands,"Staffordshire, Warwickshire","Staffordshire, Warwickshire","Birmingham, Lichfield, North Warwickshire","Sutton Mere Green, Bourne Vale, Sutton Roughley, Curdworth, Sutton Trinity, Sutton Reddicap, Sutton Four Oaks",2021.0,27136.0,341855.2
B76,"E07000218, E08000025",West Midlands,Warwickshire,Warwickshire,"North Warwickshire, Birmingham","Curdworth, Sutton Walmley & Minworth, Sutton Reddicap, Castle Vale, Sutton Trinity, Sutton Wylde Green, Water Orton",2021.0,18731.0,241954.1
B77,"E07000199, E07000218",West Midlands,"Staffordshire, Warwickshire","Staffordshire, Warwickshire","Tamworth, North Warwickshire","Castle, Belgrave, Trinity, Hurley and Wood End, Bolehall, Glascote, Wilnecote, Amington, Stonydelph, Dordon",2021.0,57798.0,880130.3
B78,"E07000218, E07000194, E07000199",West Midlands,"Warwickshire, Staffordshire","Warwickshire, Staffordshire","North Warwickshire, Lichfield, Tamworth","Polesworth West, Newton Regis and Warton, Dordon, Polesworth East, Baddesley and Grendon, Bourne Vale, Curdworth, Kingsbury, Hurley and Wood End, Whittington & Streethay, Castle, Fazeley, Bolehall",2021.0,25188.0,229856.4
B79,"E07000194, E07000218, E07000199, E07000134","West Midlands, East Midlands","Staffordshire, Warwickshire, Leicestershire","Staffordshire, Warwickshire, Leicestershire","Lichfield, North Warwickshire, Tamworth, North West Leicestershire","Whittington & Streethay, Mease Valley, Newton Regis and Warton, Spital, Amington, Polesworth East, Appleby, Castle, Mercian, Bolehall",2021.0,24388.0,310662.7
B8,E08000025,West Midlands,,,Birmingham,"Alum Rock, Bordesley & Highgate, Nechells, Ward End, Glebe Farm & Tile Cross, Bromford & Hodge Hill",2021.0,46053.0,1275696.7
B80,"E07000221, E07000236",West Midlands,"Warwickshire, Worcestershire","Warwickshire, Worcestershire","Stratford-on-Avon, Redditch","Studley North, Wootton Wawen, Matchborough, Studley South, Greenlands, Abbey",2021.0,8523.0,80194.4
B9,E08000025,West Midlands,,,Birmingham,"Bordesley & Highgate, Bordesley Green, Heartlands",2021.0,23076.0,562094.5
B90,"E08000029, E07000234",West Midlands,Worcestershire,Worcestershire,"Solihull, Bromsgrove","Shirley West, Wythall East, Blythe, Shirley South, Shirley East, Olton",2021.0,50700.0,718700.5
B91,E08000029,West Midlands,,,Solihull,"Silhill, Olton, St Alphege, Shirley East, Shirley South, Lyndon, Bickenhill, Knowle",2021.0,34454.0,357104.9
B92,"E08000029, E08000025",West Midlands,,,"Solihull, Birmingham","Bickenhill, Meriden, Elmdon, St Alphege, Olton, Lyndon, Sheldon",2021.0,32973.0,475561.5
B93,"E08000029, E07000222",West Midlands,Warwickshire,Warwickshire,"Solihull, Warwick","Knowle, Meriden, Kenilworth Abbey & Arden, Bickenhill, Dorridge and Hockley Heath",2021.0,20123.0,172230.2
B94,"E07000221, E08000029, E07000222",West Midlands,Warwickshire,Warwickshire,"Stratford-on-Avon, Solihull, Warwick","Tanworth-in-Arden, Wootton Wawen, Dorridge and Hockley Heath, Blythe, Knowle, Kenilworth Abbey & Arden",2021.0,7279.0,19642.9
B95,"E07000221, E07000222",West Midlands,Warwickshire,Warwickshire,"Stratford-on-Avon, Warwick","Henley-in-Arden, Wootton Wawen, Claverdon & Snitterfield, Kenilworth Abbey & Arden, Tanworth-in-Arden, Kinwarton",2021.0,6674.0,42724.3
B96,"E07000236, E07000238, E07000221",West Midlands,"Worcestershire, Warwickshire","Worcestershire, Warwickshire","Redditch, Wychavon, Stratford-on-Avon","Astwood Bank and Feckenham, Inkberrow, Studley South, Abbey",2021.0,5063.0,25104.5
B97,"E07000236, E07000234, E07000221",West Midlands,"Worcestershire, Warwickshire","Worcestershire, Warwickshire","Redditch, Bromsgrove, Stratford-on-Avon","Abbey, Central, Headless Cross and Oakenshaw, West, Batchley & Brockhill, Crabbs Cross, Astwood Bank and Feckenham, Tardebigge, Studley North, Alvechurch South",2021.0,35060.0,482482.0
B98,"E07000236, E07000234, E07000221",West Midlands,"Worcestershire, Warwickshire","Worcestershire, Warwickshire","Redditch, Bromsgrove, Stratford-on-Avon","Matchborough, Winyates, Greenlands, Abbey, Central, Lodge Park, Headless Cross and Oakenshaw, Church Hill, Alvechurch South, Tanworth-in-Arden, Wootton Wawen",2021.0,47001.0,698779.3
B99,E08000025,West Midlands,,,Birmingham,Newtown,,,
BA1,"E06000022, E06000025",South West,,,"Bath and North East Somerset, South Gloucestershire","Kingsmead, Lansdown, Weston, Newbridge, Bathavon North, Bathwick, Walcot, Lambridge, Boyd Valley, Bitton & Oldland Common",2021.0,48308.0,994469.1
BA10,E06000066,South West,,,Somerset,"Wincanton & Bruton, Mendip Central and East, Mendip South",2021.0,5189.0,18019.6
BA11,"E06000066, E06000054",South West,,,"Somerset, Wiltshire","Frome West, Frome East, Frome North, Mendip Central and East, Ethandune, Mendip Hills, Southwick",2021.0,37881.0,450005.8
BA12,E06000054,South West,,,Wiltshire,"Warminster North & Rural, Wylye Valley, Warminster East, Nadder Valley, Mere, Warminster West, Warminster Broadway",2021.0,30324.0,211919.3
BA13,"E06000054, E06000066",South West,,,"Wiltshire, Somerset","Westbury West, Westbury North, Westbury East, Ethandune, Warminster North & Rural, Frome East, Southwick, Devizes Rural West, Melksham Without West & Rural",2021.0,22145.0,240553.6
BA14,E06000054,South West,,,Wiltshire,"Trowbridge Central, Trowbridge Grove, Trowbridge Drynham, Southwick, Trowbridge Lambrok, Trowbridge Park, Melksham Without West & Rural, Holt, Trowbridge Paxcroft, Hilperton, Devizes Rural West, Trowbridge Adcroft, Winsley & Westwood, Ethandune",2021.0,51892.0,696637.6
BA15,"E06000054, E06000022",South West,,,"Wiltshire, Bath and North East Somerset","Bradford-on-Avon South, Bradford-on-Avon North, Winsley & Westwood, Bathavon South",2021.0,14212.0,138717.9
BA16,E06000066,South West,,,Somerset,"Street, Mendip West, Glastonbury, King Alfred",2021.0,14565.0,172029.6
BA2,"E06000022, E06000054, E06000066",South West,,,"Bath and North East Somerset, Wiltshire, Somerset","Timsbury, Clutton & Farmborough, Bathavon South, Westmoreland, Southdown, Twerton, Widcombe & Lyncombe, Odd Down, Moorlands, Oldfield Park, Kingsmead, Bathwick, Combe Down, Bathavon North, Winsley & Westwood, Frome North, Mendip Central and East, Peasedown, Saltford",2021.0,75196.0,1196140.0
BA20,E06000066,South West,,,Somerset,"Yeovil South, Yeovil Central, Yeovil West, Brympton, Coker",2021.0,14301.0,167580.9
BA21,"E06000066, E06000059",South West,,,"Somerset, Dorset","Yeovil Central, Yeovil West, Yeovil South, Brympton, Yeovil East, Castle Cary, Sherborne Rural",2021.0,35441.0,629354.8
BA22,"E06000066, E06000059",South West,,,"Somerset, Dorset","Castle Cary, Blackmoor Vale, Yeovil South, Brympton, Martock, Somerton, Coker, Yetminster, Sherborne Rural",2021.0,19235.0,61402.1
BA3,"E06000022, E06000066",South West,,,"Bath and North East Somerset, Somerset","Midsomer Norton North, Midsomer Norton Redfield, Mendip Hills, Paulton, Radstock, Westfield, Mendip, Mendip Central and East, Frome North",2021.0,38509.0,271810.6
BA4,E06000066,South West,,,Somerset,"Mendip West, Mendip Central and East, Shepton Mallet, Mendip South, Mendip Hills",2021.0,18186.0,144030.1
BA5,E06000066,South West,,,Somerset,"Mendip West, Wells, King Alfred, Mendip Hills, Cheddar, Shepton Mallet",2021.0,19249.0,152916.4
BA6,E06000066,South West,,,Somerset,"Glastonbury, Street, Mendip South, Mendip West, King Alfred",2021.0,12773.0,84492.1
BA7,E06000066,South West,,,Somerset,"Castle Cary, Mendip South, Wincanton & Bruton",2021.0,3857.0,22921.300000000003
BA8,"E06000066, E06000059",South West,,,"Somerset, Dorset","Blackmoor Vale, Stalbridge & Marnhull, Wincanton & Bruton",2021.0,5248.0,8736.1
BA9,E06000066,South West,,,Somerset,"Wincanton & Bruton, Blackmoor Vale, Castle Cary",2021.0,7512.0,62743.1
BB1,"E06000008, E07000120, E07000125, E07000124",North West,Lancashire,Lancashire,"Blackburn with Darwen, Hyndburn, Rossendale, Ribble Valley","Audley & Queen's Park, Blackburn Central, Blackburn South East, Little Harwood & Whitebirk, Blackburn South & Lower Darwen, St Oswald's, West Pennine, Immanuel, Helmshore, Rishton, Bastwell & Daisyfield, Overton, Wilpshire & Ramsgreave, Roe Lee, Shear Brow & Corporation Park, Billinge & Beardwood, Clayton-le-Dale & Salesbury, Mellor",2021.0,76011.0,1407782.8
BB10,"E07000117, E07000122",North West,Lancashire,Lancashire,"Burnley, Pendle","Daneshouse with Stoneyholme, Bank Hall, Queensgate, Lanehead, Briercliffe, Brierfield West & Reedley, Brierfield East & Clover Hill, Cliviger with Worsthorne, Marsden & Southfield, Brunshaw",2021.0,43985.0,965243.0
BB11,E07000117,North West,Lancashire,Lancashire,Burnley,"Daneshouse with Stoneyholme, Trinity, Bank Hall, Rosehill with Burnley Wood, Coal Clough with Deerplay, Brunshaw, Cliviger with Worsthorne, Rosegrove with Lowerhouse, Hapton with Park",2021.0,25257.0,478491.1
BB12,"E07000117, E07000122, E07000124",North West,Lancashire,Lancashire,"Burnley, Pendle, Ribble Valley","Daneshouse with Stoneyholme, Queensgate, Brierfield West & Reedley, Whittlefield with Ightenhill, Gannow, Trinity, Rosegrove with Lowerhouse, Gawthorpe, Hapton with Park, East Whalley, Read & Simonstone, Sabden, Fence & Higham, Barrowford & Pendleside",2021.0,35181.0,549509.8
BB18,"E07000122, E06000065","North West, Yorkshire and The Humber",Lancashire,Lancashire,"Pendle, North Yorkshire","Barnoldswick, Earby & Coates, Skipton West & West Craven",2021.0,18162.0,282783.3
BB2,"E06000008, E07000118, E07000124, E07000126",North West,Lancashire,Lancashire,"Blackburn with Darwen, Chorley, Ribble Valley, South Ribble","Blackburn Central, Wensley Fold, Mill Hill & Moorgate, Billinge & Beardwood, Livesey with Pleasington, Blackburn South & Lower Darwen, Blackburn South East, Ewood, Clayton East, Brindle & Hoghton, Chorley North East, Shear Brow & Corporation Park, Wilpshire & Ramsgreave, Mellor, Samlesbury & Walton, Clayton-le-Dale & Salesbury",2021.0,61195.0,1065783.7
BB3,E06000008,North West,,,Blackburn with Darwen,"Darwen West, Darwen East, Blackburn South & Lower Darwen, West Pennine, Ewood, Livesey with Pleasington, Blackburn South East, Darwen South",2021.0,32708.0,545526.1
BB4,E07000125,North West,Lancashire,Lancashire,Rossendale,"Hareholme, Helmshore, Worsley, Greenfield, Longholme, Eden, Whitewell, Cribden, Goodshaw",2021.0,42594.0,489215.7
BB5,"E07000120, E07000125",North West,Lancashire,Lancashire,"Hyndburn, Rossendale","Central, Church, St Andrew's, Spring Hill, Immanuel, Barnfield, Peel, Milnshaw, Worsley, Baxenden, St Oswald's, Altham, Rishton, Clayton-le-Moors, Huncoat",2021.0,62228.0,1178193.6
BB6,"E07000120, E06000008, E07000124",North West,Lancashire,Lancashire,"Hyndburn, Blackburn with Darwen, Ribble Valley","Netherton, Overton, Blackburn Central, Billington & Langho, Brockhall & Dinckley, Wilpshire & Ramsgreave",2021.0,24846.0,304998.4
BB7,"E07000124, E07000122, E07000120",North West,Lancashire,Lancashire,"Ribble Valley, Pendle, Hyndburn","St Mary's, Salthill, Primrose, Littlemoor, Edisford & Low Moor, Wiswell & Barrow, Chatburn, Waddington, Bashall Eaves & Mitton, Bowland, West Bradford & Grindleton, Hurst Green & Whitewell, Chipping, Gisburn & Rimington, Barnoldswick, Whalley & Painter Wood, Sabden, East Whalley, Read & Simonstone, Whalley Nethertown, Billington & Langho, Brockhall & Dinckley, Overton",2021.0,25084.0,265774.3
BB8,E07000122,North West,Lancashire,Lancashire,Pendle,"Vivary Bridge, Waterside & Horsfield, Boulsworth & Foulridge, Earby & Coates, Whitefield & Walverden, Bradley, Barrowford & Pendleside",2021.0,24261.0,346671.9
BB9,"E07000122, E07000124",North West,Lancashire,Lancashire,"Pendle, Ribble Valley","Whitefield & Walverden, Brierfield East & Clover Hill, Marsden & Southfield, Bradley, Brierfield West & Reedley, Barrowford & Pendleside, Gisburn & Rimington, Barnoldswick, Fence & Higham",2021.0,47077.0,1123616.7
BB94,E07000122,North West,Lancashire,Lancashire,Pendle,Earby & Coates,,,
BD1,E08000032,Yorkshire and The Humber,,,Bradford,"City, Bolton and Undercliffe, Manningham, Bowling and Barkerend",2021.0,13053.0,264707.0
BD10,"E08000032, E08000035",Yorkshire and The Humber,,,"Bradford, Leeds","Idle and Thackley, Eccleshill, Calverley & Farsley, Horsforth, Windhill and Wrose",2021.0,31566.0,455061.8
BD11,"E08000035, E08000034, E08000032",Yorkshire and The Humber,,,"Leeds, Kirklees, Bradford","Morley North, Birstall and Birkenshaw, Tong, Cleckheaton",2021.0,13651.0,113905.4
BD12,"E08000032, E08000034",Yorkshire and The Humber,,,"Bradford, Kirklees","Royds, Wyke, Little Horton, Cleckheaton, Tong",2021.0,18569.0,220444.1
